<?xml version='1.0' encoding="UTF-8"?>
<!ELEMENT message
   (#PCDATA)
>
<!--
   <annotation>
      <appinfo source='com.ibm.DDbEv2.Models.AbstractXModel.POSSIBLE'>
         <restriction base='string'/>
      </appinfo>
   </annotation>
-->

<!ATTLIST message
key CDATA #REQUIRED
>
<!--
   <annotation>
      <appinfo source='com.ibm.DDbEv2.Models.AbstractXModel.POSSIBLE'>
         <restriction base='string'/>
      </appinfo>
   </annotation>
-->

<!ATTLIST message
lang CDATA #REQUIRED
>
<!ELEMENT messages
   (message+)
>
